{
  "pack_version": "0.3.0",
  "template": true,
  "meta": {
    "id": "example-enterprise-outage",
    "name": "[示例] 模板：区域数据中心中断与客户数据泄露",
    "sector": "enterprise",
    "jurisdiction": "CN",
    "classification": "internal",
    "lang": "zh",
    "owner": "TODO: team accountable for this pack",
    "updated": "2026-10-31"
  },
  "timeline": {
    "T-72h": "[TEMPLATE] Public information available 72 hours before T0 only: what the organisation, regulators, media and customers could already see. No outcome, no penalty, no stock reaction.",
    "T-48h": "[TEMPLATE] Optional checkpoint: signals that became public.",
    "T-24h": "[TEMPLATE] Optional checkpoint: internal signals, draft statements, pending disclosures.",
    "T0": "[TEMPLATE] The public trigger: the first public, attributable event.",
    "T+24h": "[TEMPLATE] Planned first-24h response: statement, escalation level, owners.",
    "T+72h": "[TEMPLATE] Planned 72h posture: what has been said and decided.",
    "T+7d": "[TEMPLATE] Planned one-week review: what the team will assess."
  },
  "stakeholders": [
    {
      "role": "[TEMPLATE] Corporate spokesperson / 新闻发言人",
      "kind": "internal",
      "influence": 5,
      "stance": "[TEMPLATE] describes the expected or observed stance",
      "interests": [
        "[TEMPLATE] interest 1",
        "[TEMPLATE] interest 2"
      ]
    },
    {
      "role": "[TEMPLATE] Primary regulator / 行业主管部门",
      "kind": "regulator",
      "influence": 5,
      "stance": "[TEMPLATE] describe how the regulator is likely to react",
      "interests": [
        "[TEMPLATE] mandate the regulator is protecting"
      ]
    }
  ],
  "regulatory_triggers": [
    {
      "framework": "TODO: name the law, regulation or standard that applies",
      "jurisdiction": "CN",
      "requirement": "TODO: what the framework requires in plain language",
      "status": "unverified",
      "evidence": "TODO: where the mapping is documented (not a certificate)"
    }
  ],
  "escalation_ladder": [
    {
      "level": 1,
      "trigger": "[TEMPLATE] an observable condition (e.g. one media outlet reports the issue)",
      "owner": "TODO: role, not name",
      "action": "[TEMPLATE] what happens at this level",
      "sla_hours": 24
    },
    {
      "level": 2,
      "trigger": "[TEMPLATE] the crisis crosses a threshold",
      "owner": "TODO: role, not name",
      "action": "[TEMPLATE] what happens at this level",
      "sla_hours": 4
    },
    {
      "level": 3,
      "trigger": "[TEMPLATE] regulator or board involvement",
      "owner": "TODO: role, not name",
      "action": "[TEMPLATE] what happens at this level",
      "sla_hours": 1
    }
  ],
  "kpis": [
    {
      "id": "time_to_first_statement",
      "name": "[TEMPLATE] Time to the first public statement",
      "target": "<= 4",
      "unit": "hours",
      "window": "from T0",
      "source": "TODO: which system or report holds this number"
    },
    {
      "id": "stakeholder_alignment",
      "name": "[TEMPLATE] Stakeholders briefed before the statement",
      "target": "100",
      "unit": "%",
      "window": "before the first statement",
      "source": "TODO: attendance or sign-off record"
    },
    {
      "id": "decision_latency",
      "name": "[TEMPLATE] Median decision latency inside the ladder",
      "target": "<= 2",
      "unit": "hours",
      "source": "TODO: decision log"
    }
  ],
  "decision_log": [],
  "evidence": [],
  "provenance": {
    "author": "TODO: pack owner",
    "created": "2026-10-31",
    "source": "TODO: public sources only, or state the internal source and classification",
    "license": "TODO: e.g. CC-BY-4.0 or internal-only",
    "notes": "TEMPLATE generated by `crh pack init`. Replace every placeholder before running a rehearsal; a template is a scaffold, not evidence."
  }
}
